Video ID,Category,Script,Final
0TLQg_b1v5Q,Health.xlsx,I'm going to work my left buttocks,instruction
0TLQg_b1v5Q,Health.xlsx,"OK, we're going to bend that knee in front of us just like this as I show you here",instruction
0TLQg_b1v5Q,Health.xlsx,Keep that back leg straight as possible.,instruction
0TLQg_b1v5Q,Health.xlsx,Keeping your knee obviously behind you,instruction
0TLQg_b1v5Q,Health.xlsx,"Keeping that back straight and all we're going to do is just lean our body forward, and if you can't go all the way down, just go down to the point to where you really feel that left buttocks burn",instruction
0TLQg_b1v5Q,Health.xlsx,Right side Now ,transition
0TLQg_b1v5Q,Health.xlsx,"got the right knee bent, left leg straight behind us arms resting on the floor and just leading forward leaning forward far as you can",instruction
0TLQg_b1v5Q,Health.xlsx,"If you can go down all the way down, great, hold it there good 30 seconds and Relax.",instruction
0TLQg_b1v5Q,Health.xlsx,the last exercise is taking a ball that you have,subgoal
0TLQg_b1v5Q,Health.xlsx,"a tennis ball, a golf ball, a softball anything that's hard and firm lacrosse ball, something that we can put pressure and need that muscle.",tool (multiple)
0TLQg_b1v5Q,Health.xlsx,and the way we're going to do this is a modification of the piriformis stretch but a little different,subgoal
0TLQg_b1v5Q,Health.xlsx,and what we're going to do is we're going to work the left side OK,instruction
0TLQg_b1v5Q,Health.xlsx,We're going to bend that left knee behind this.,instruction
0TLQg_b1v5Q,Health.xlsx,"Right knee, we're just like this, we'll put that left ankle behind the right knee",instruction
0TLQg_b1v5Q,Health.xlsx,"We're not going to really pull up much like we did before, but we're going to leave it like this and we're going to put the ball in that area",instruction
0TLQg_b1v5Q,Health.xlsx,That's giving us problem that lower buttocks area to release that muscle,instruction
0TLQg_b1v5Q,Health.xlsx,"And once it's in there, we're going to pull up a little bit",instruction
0TLQg_b1v5Q,Health.xlsx,But we're just kind of kind of roll little circles.,instruction
0TLQg_b1v5Q,Health.xlsx,"Good, it's just going to roll over that point",instruction
0TLQg_b1v5Q,Health.xlsx,You can reposition it a different area.,instruction
0TLQg_b1v5Q,Health.xlsx,And roll over that point and,instruction
0TLQg_b1v5Q,Health.xlsx,the reason why we're bending this knee a little bit is that we want to take tension off the external rotators,justification
0TLQg_b1v5Q,Health.xlsx,"OK, so as we do it, we're kind of taking tension off that muscle in the buttocks, as we're rolling that ball and little circles",justification
0TLQg_b1v5Q,Health.xlsx,You can do that,filler
0TLQg_b1v5Q,Health.xlsx,"Be a little creative, 30 seconds a minute, 2 minutes",instruction (multiple)
0TLQg_b1v5Q,Health.xlsx,Just get to that area until you release that tight trigger point,instruction
0TLQg_b1v5Q,Health.xlsx,So these are four great stretch exercises you can do to help.,reflection
0TLQg_b1v5Q,Health.xlsx,Combat that sciatic lower back discomfort when those muscles contract are squeezing on those nerves,reflection
0TLQg_b1v5Q,Health.xlsx,We want to get them to relax so we can give you lots of relief,reflection
0TLQg_b1v5Q,Health.xlsx,I ask you to share this video,outro
0TLQg_b1v5Q,Health.xlsx,"Subscribe and most important, make it a great day.",outro
0TLQg_b1v5Q,Health.xlsx,I'm doctor Alan Mandel.,outro
1Ni8KOzRzuI,Health.xlsx,hi everyone hi,greeting
1Ni8KOzRzuI,Health.xlsx,this is ashoka,greeting
1Ni8KOzRzuI,Health.xlsx,welcome once again to my channel,greeting
1Ni8KOzRzuI,Health.xlsx,,
1Ni8KOzRzuI,Health.xlsx,,
1Ni8KOzRzuI,Health.xlsx,,
1Ni8KOzRzuI,Health.xlsx,,
1Ni8KOzRzuI,Health.xlsx,,
1Ni8KOzRzuI,Health.xlsx,,
1Ni8KOzRzuI,Health.xlsx,,
1Ni8KOzRzuI,Health.xlsx,,
1Ni8KOzRzuI,Health.xlsx,,
1Ni8KOzRzuI,Health.xlsx,,
1Ni8KOzRzuI,Health.xlsx,,
1Ni8KOzRzuI,Health.xlsx,,
1Ni8KOzRzuI,Health.xlsx,,
1Ni8KOzRzuI,Health.xlsx,but we are also smart life,side note
1Ni8KOzRzuI,Health.xlsx,,
1Ni8KOzRzuI,Health.xlsx,so let's get started,transition
1Ni8KOzRzuI,Health.xlsx,,
1Ni8KOzRzuI,Health.xlsx,if you have a face steamer that is,tool
,,yeah,filler
,,the started and see how i make my homemade scrub,subgoal
,,it gives us a cooling sensation and it is also good for brightening our skill,justification
,,are your scrub all over your face and neck or if you have any tanning in your hand you can use it there also and massage it very gently,instruction
,,do not put pressure mass massage it very gently clockwise and anti clockwise for like three to four minute and it was scrubbing,instruction
,,next thing is ten removing pack,subgoal
,,mix them all and your tanning removal pack is ready,instruction
,,give it back all over your face and neck for like twenty to twenty five minutes and wash it off with cold water,instruction
,,and after that take two to three ice cube and rub it all over your skin,instruction
,,so that it can come down your skin,effect
,,after that apply coconut oil all over your face and neck and then sleep,instruction
,,hope you like this one,outro
,,if you like my videos make sure you subscribe to my channel inform your friends and relatives about it and make sure them they are also subscribed to it,outro
,,like my videos comment down if you have any queries and i'll see you in my next video,outro
,,till then be happy and bye bye,outro
AnWGek4P_dY,Holidays and Traditions.xlsx,"Hi guys, it's Mimi here and welcome to people like Paul",greeting
AnWGek4P_dY,Holidays and Traditions.xlsx,I don't know why but I was in a 90s kind of mood today so this happened,side note
AnWGek4P_dY,Holidays and Traditions.xlsx,It's super funny,side note
AnWGek4P_dY,Holidays and Traditions.xlsx,"This week's tutorial is a bit different than what I usually make since this involves sewing and so fluffy socks, but I want to start off by saying an enormous gigantic.",briefing
AnWGek4P_dY,Holidays and Traditions.xlsx,Thank you to my mommy for coming over to help me figure out how we would put the hatchimals together and also for helping me suing them,side note
AnWGek4P_dY,Holidays and Traditions.xlsx,She is the best sewing Jedi master ever,side note
AnWGek4P_dY,Holidays and Traditions.xlsx,So tonight I'm showing you guys how to make your own hatchimal using some 40 cheap materials,goal
AnWGek4P_dY,Holidays and Traditions.xlsx,So it's like me you just can't afford a real hatchimal,motivation
AnWGek4P_dY,Holidays and Traditions.xlsx,Or maybe you have a hatchimal and would like to make her a little brother or sister,motivation
AnWGek4P_dY,Holidays and Traditions.xlsx,This superfamily alloy is just for you,motivation
AnWGek4P_dY,Holidays and Traditions.xlsx,I also prepare for you guys you print out with all the patterns you will need for this.,tool
AnWGek4P_dY,Holidays and Traditions.xlsx,"Project you will find a link to the print out in the description box below, so have fun and here we go",tool
AnWGek4P_dY,Holidays and Traditions.xlsx,First some of the materials you will need two fuzzy socks of any color you like,tool
AnWGek4P_dY,Holidays and Traditions.xlsx,A large plastic egg,tool
AnWGek4P_dY,Holidays and Traditions.xlsx,I bought mine at the dollar store,tool
AnWGek4P_dY,Holidays and Traditions.xlsx,"Some felt a glue gun, fabric, scissors, needle and thread and tacky",tool
AnWGek4P_dY,Holidays and Traditions.xlsx,"Glue glass stain, 3D paint and acrylic paint",tool
AnWGek4P_dY,Holidays and Traditions.xlsx,"A bit of polymer, clay and aluminum foil cotton wool filling and a print out of the pattern sheet I made just for you first",tool
AnWGek4P_dY,Holidays and Traditions.xlsx,Take this off you will use for the buddy measure 7 inches from the top.,instruction
AnWGek4P_dY,Holidays and Traditions.xlsx,And cut off the rest.,instruction
AnWGek4P_dY,Holidays and Traditions.xlsx,"Now start filling your sock with the cotton wool, giving it the texture you prefer, and use the circle pattern to trace and cut out the bottom of your hatchimal.",instruction
AnWGek4P_dY,Holidays and Traditions.xlsx,"Just secure the thread, leave a bit of thread and make three stitches at the same place",instruction
AnWGek4P_dY,Holidays and Traditions.xlsx,This way your thread won't unravel,justification
AnWGek4P_dY,Holidays and Traditions.xlsx,It can stitch in the soft fabric at about 1/4 inch from the edge,instruction
AnWGek4P_dY,Holidays and Traditions.xlsx,Then make another stitch in the felt again at 1/4 inch from the edge,instruction
AnWGek4P_dY,Holidays and Traditions.xlsx,Then keep going around the base until you only have a couple inches left before closing your work,instruction
AnWGek4P_dY,Holidays and Traditions.xlsx,"If necessary, add some filling in the body, then finish off the same way you started securing your thread",instruction (optional)
AnWGek4P_dY,Holidays and Traditions.xlsx,Now at this point some socks will naturally curl on top of the base like the White one did.,description
AnWGek4P_dY,Holidays and Traditions.xlsx,"But if the fabric sticks out like this one, simply glue the edge on top of the base like so",instruction
AnWGek4P_dY,Holidays and Traditions.xlsx,I'll use the stick to prevent burns from the evil glue gun,instruction
AnWGek4P_dY,Holidays and Traditions.xlsx,Now start a running stitch at 2 inches and a half from the top of the stock or the stick,instruction
AnWGek4P_dY,Holidays and Traditions.xlsx,Simply go in and out of the fabric in a straight line.,instruction
AnWGek4P_dY,Holidays and Traditions.xlsx,"Once you've come back to the starting point, start pulling very gently on your thread, which will slowly make a separation between the head and body",instruction
AnWGek4P_dY,Holidays and Traditions.xlsx,"Make sure you don't pull too much, since the original hatchimals have a very small gap between the head and body",instruction
AnWGek4P_dY,Holidays and Traditions.xlsx,Then don't forget to secure your thread,instruction
AnWGek4P_dY,Holidays and Traditions.xlsx,Now cut a second sock using the seven inches measure,instruction
AnWGek4P_dY,Holidays and Traditions.xlsx,Cut open the top part of the sock,instruction
AnWGek4P_dY,Holidays and Traditions.xlsx,Use the front front patterns to cut it out,instruction
AnWGek4P_dY,Holidays and Traditions.xlsx,"Now start sewing the fur in place by stitching a bit of body fabric, then a bit of fur fabric going from the right to the left or around the piece.",instruction
AnWGek4P_dY,Holidays and Traditions.xlsx,"Or the four tools Antenna Stick 2 pin needles where you want them to be, then pull on one end of a purple pipe cleaner through a large needle, then poke the needle through the two pin needle holes.",instruction
AnWGek4P_dY,Holidays and Traditions.xlsx,Measure about 2 inches on each side and cut off the excess,instruction
AnWGek4P_dY,Holidays and Traditions.xlsx,Then twist them in a swirl trace and cut out all the pieces for the burtles wings,instruction
AnWGek4P_dY,Holidays and Traditions.xlsx,Glue all the pieces in place.,instruction
AnWGek4P_dY,Holidays and Traditions.xlsx,Then paint a little flower into dust with puffy paint.,instruction
AnWGek4P_dY,Holidays and Traditions.xlsx,Trace and cut out the shell and paint the pattern again with some puffy paint and let the paint dry for a couple hours before handling them.,instruction
AnWGek4P_dY,Holidays and Traditions.xlsx,Trace and cut off the barricade swing pieces.,instruction
AnWGek4P_dY,Holidays and Traditions.xlsx,Then use the wing pattern to trace only the claws on pink felt,instruction
AnWGek4P_dY,Holidays and Traditions.xlsx,Cut them out and glue them on top of the wing,instruction
AnWGek4P_dY,Holidays and Traditions.xlsx,"Finally, paint on the little king does.",instruction
AnWGek4P_dY,Holidays and Traditions.xlsx,Cut out three white shapes for the barricades tail,instruction
AnWGek4P_dY,Holidays and Traditions.xlsx,Make little indents with your fabric scissors.,instruction
AnWGek4P_dY,Holidays and Traditions.xlsx,Then color the top of the fitters with pink soft,instruction
AnWGek4P_dY,Holidays and Traditions.xlsx,The stove threw them together with tacky glue and glue them on the hatchimal with a hot glue gun,instruction
AnWGek4P_dY,Holidays and Traditions.xlsx,Cut out the pieces for the ears,instruction
AnWGek4P_dY,Holidays and Traditions.xlsx,"Stick them together, then cover the edges with tacky glue so the fabric doesn't unravel",instruction
AnWGek4P_dY,Holidays and Traditions.xlsx,Blue all the wings in place using a stick to prevent burning yourself and glue on the shell on the hurdle for the beaks,instruction
AnWGek4P_dY,Holidays and Traditions.xlsx,Make a small cylinder with aluminum foil.,instruction
AnWGek4P_dY,Holidays and Traditions.xlsx,Then cover it with a thick sheet of polymer clay.,instruction
AnWGek4P_dY,Holidays and Traditions.xlsx,Roll it on your work surface,instruction
AnWGek4P_dY,Holidays and Traditions.xlsx,This without the imperfections,instruction
AnWGek4P_dY,Holidays and Traditions.xlsx,Then roll the tip a little more than the rest to make a bit of a cone shape,instruction
AnWGek4P_dY,Holidays and Traditions.xlsx,"Roll out a very small snake of clay, then stick it around the beak",instruction
AnWGek4P_dY,Holidays and Traditions.xlsx,"Take the beaks for 30 minutes, cut out the eye shapes and thin plastic",instruction
AnWGek4P_dY,Holidays and Traditions.xlsx,"Paint them the color you want, and once the paint is dry, paint on and black Oval.",instruction
AnWGek4P_dY,Holidays and Traditions.xlsx,That is small white dot poor multiple layers of glass stain on top.,instruction
AnWGek4P_dY,Holidays and Traditions.xlsx,Make sure your layers have dried overnight before handling the eye.,instruction
AnWGek4P_dY,Holidays and Traditions.xlsx,"For the egg, I simply painted the one I had with a couple layers of white paint.",instruction
AnWGek4P_dY,Holidays and Traditions.xlsx,Then I dipped the toothbrush and pink and black paint and brush the bristles of the toothbrush with a small stick to make some mini spots on the egg,instruction
AnWGek4P_dY,Holidays and Traditions.xlsx,Then I added more spots with the tip of the toothbrush and finally some little dots with a dotting tool,instruction
AnWGek4P_dY,Holidays and Traditions.xlsx,"Once the paint is dry, add a layer of glaze now to glue on the eyes and beaks",instruction
AnWGek4P_dY,Holidays and Traditions.xlsx,Cut out two more eye shapes and paper,instruction
AnWGek4P_dY,Holidays and Traditions.xlsx,"Then pin them on your hatchimal, which will help you stick them in the right places",instruction
AnWGek4P_dY,Holidays and Traditions.xlsx,Glue them all with hot glue.,instruction
AnWGek4P_dY,Holidays and Traditions.xlsx,There you go,outcome
AnWGek4P_dY,Holidays and Traditions.xlsx,Now you have your own handmade hatchimal plushie.,outcome
AnWGek4P_dY,Holidays and Traditions.xlsx,Thank you so much for watching this tutorial,outro
AnWGek4P_dY,Holidays and Traditions.xlsx,"If you liked it, you can give it a little thumbs up this way",outro
AnWGek4P_dY,Holidays and Traditions.xlsx,I know which kind of videos you guys like,outro
AnWGek4P_dY,Holidays and Traditions.xlsx,"Also, if you know someone that loves hatchimals or anything fuzzy and cute, don't forget to share this video with them",outro
AnWGek4P_dY,Holidays and Traditions.xlsx,"And if you make this project, please share a picture with me.",outro
AnWGek4P_dY,Holidays and Traditions.xlsx,Hashtag geek like full I love you guys and I wish you all a beautiful day and God bless you bye.,outro
AnWGek4P_dY,Holidays and Traditions.xlsx,It won't go into geek life for even the wings flap guys,side note
AnWGek4P_dY,Holidays and Traditions.xlsx,How awesome is this?,side note
AnWGek4P_dY,Holidays and Traditions.xlsx,Ohh I feel like a little kid with this on how to like kids so much,side note
AnWGek4P_dY,Holidays and Traditions.xlsx,Ohh my gosh no no no.,side note
AnWGek4P_dY,Holidays and Traditions.xlsx,"OK, never mind lettering letter, I'm blabbering.",side note
AnWGek4P_dY,Holidays and Traditions.xlsx,BlackBerry.,side note
AnWGek4P_dY,Holidays and Traditions.xlsx,Bladder hands I'm gonna go pee pee.,side note
7IcOJEEObA0,Holidays and Traditions.xlsx,hello everyone,greeting
7IcOJEEObA0,Holidays and Traditions.xlsx,today we're going to be looking at the love monster which is one of my favorite books,briefing
7IcOJEEObA0,Holidays and Traditions.xlsx,it's by rachel bright and it features this adorable monster who lives in cutesy ville where everything in cutes ville is super cute and he doesn't feel very cute,background info
7IcOJEEObA0,Holidays and Traditions.xlsx,and so we're going to give him some love and attention by learning how to draw love monster today,goal
7IcOJEEObA0,Holidays and Traditions.xlsx,so i'm going to teach you how to start with a piece of paper and a pencil and you can put your love monster anywhere,goal
7IcOJEEObA0,Holidays and Traditions.xlsx,if you want to put them in the middle,briefing
7IcOJEEObA0,Holidays and Traditions.xlsx,if you want to put them on the side it's up to you,briefing
7IcOJEEObA0,Holidays and Traditions.xlsx,i think i'm just going to put mine on the side and maybe add some more details over here,briefing
7IcOJEEObA0,Holidays and Traditions.xlsx,so to start love monster,transition
7IcOJEEObA0,Holidays and Traditions.xlsx,we're going to start at the top of his head and when we're drawing something new,instruction
7IcOJEEObA0,Holidays and Traditions.xlsx,you want to draw a light,instruction
7IcOJEEObA0,Holidays and Traditions.xlsx,so i'm going to draw kind of a rounded rainbow line and his ears are triangles,instruction
7IcOJEEObA0,Holidays and Traditions.xlsx,i'm going to draw two triangles and then i'm going to come down and and just finish off his shape,instruction
7IcOJEEObA0,Holidays and Traditions.xlsx,he's got kind of a blocky rectangle shape,instruction
7IcOJEEObA0,Holidays and Traditions.xlsx,and then we're going to add his arms in his toes and everything,instruction
7IcOJEEObA0,Holidays and Traditions.xlsx,so we might have to do some racing today,instruction
7IcOJEEObA0,Holidays and Traditions.xlsx,i'm going to keep my eraser handy,side note
7IcOJEEObA0,Holidays and Traditions.xlsx,i'm going to give him his eyes and i notice that one eye is a little bit bigger than the other,instruction
7IcOJEEObA0,Holidays and Traditions.xlsx,which is so charming,side note
7IcOJEEObA0,Holidays and Traditions.xlsx,and these are the eyeballs,instruction
7IcOJEEObA0,Holidays and Traditions.xlsx,and now you can add the pupils and he can look kind of wherever he wants,instruction
7IcOJEEObA0,Holidays and Traditions.xlsx,like maybe mine's going to look over to the side and we'll give him some eyebrows,instruction
7IcOJEEObA0,Holidays and Traditions.xlsx,now he has this kind of lopsided face with these cute's sharp teeth sticking out,instruction
7IcOJEEObA0,Holidays and Traditions.xlsx,and then now we're going to put in his toes which are going to go along this line,instruction
7IcOJEEObA0,Holidays and Traditions.xlsx,and he has he's a three toed monster and so for the toes you're going to do the three circles for each foot,instruction
7IcOJEEObA0,Holidays and Traditions.xlsx,i'm going to erase that line in the middle there yup,instruction
7IcOJEEObA0,Holidays and Traditions.xlsx,and add in his toenails which are triangles so so add in those trying though,instruction
7IcOJEEObA0,Holidays and Traditions.xlsx,ok so now he has a little bit of a tail so you can make it come out on the side or come out on this side,early instruction (multiple)
7IcOJEEObA0,Holidays and Traditions.xlsx,but it's just going to go down like that,instruction
7IcOJEEObA0,Holidays and Traditions.xlsx,and then i will erase the slime,instruction
7IcOJEEObA0,Holidays and Traditions.xlsx,and now we need to add in his fuzzy arms,subgoal
7IcOJEEObA0,Holidays and Traditions.xlsx,so in one arm he does hold a teddy bear and i'll show you how to draw that one,subgoal
7IcOJEEObA0,Holidays and Traditions.xlsx,i'll leave a circle here to show the shape of the bear and then the arm is going to go around and these are going to be his fingers,instruction
7IcOJEEObA0,Holidays and Traditions.xlsx,he can grab his bear and we'll erase some of these lines,instruction
7IcOJEEObA0,Holidays and Traditions.xlsx,now if your love monster does not look like mrs,side note
7IcOJEEObA0,Holidays and Traditions.xlsx,belzer's or the or the monster in the book just turn it into your own love monster,side note
7IcOJEEObA0,Holidays and Traditions.xlsx,it doesn't have to look just like this one right,side note
7IcOJEEObA0,Holidays and Traditions.xlsx,you are artist,side note
7IcOJEEObA0,Holidays and Traditions.xlsx,you're going to make your own decisions on what to make here,side note
7IcOJEEObA0,Holidays and Traditions.xlsx,i'm just going to put in the face for his little bear which kind of looks like him,instruction
7IcOJEEObA0,Holidays and Traditions.xlsx,there we go,outcome
7IcOJEEObA0,Holidays and Traditions.xlsx,ok and then the other arm can be down at his side just down here,instruction
7IcOJEEObA0,Holidays and Traditions.xlsx,i will put in his my fingers and his fur,instruction
7IcOJEEObA0,Holidays and Traditions.xlsx,oh ok,filler
7IcOJEEObA0,Holidays and Traditions.xlsx,once you are done drawing love munster and you are happy with how he looks,description
7IcOJEEObA0,Holidays and Traditions.xlsx,oh i forgot something black monster because he's a love monster,justification
7IcOJEEObA0,Holidays and Traditions.xlsx,he has heart,instruction
7IcOJEEObA0,Holidays and Traditions.xlsx,ok anyway when you are done coloring love monster we're going to use oil pastels,tool
7IcOJEEObA0,Holidays and Traditions.xlsx,oil pastels are,tool
7IcOJEEObA0,Holidays and Traditions.xlsx,they're also called crepas,tool
7IcOJEEObA0,Holidays and Traditions.xlsx,they are crayons but there are more oily,tool
7IcOJEEObA0,Holidays and Traditions.xlsx,and so i'm going to because i'm using pink paper and use a color in the whites of his eyes,instruction
7IcOJEEObA0,Holidays and Traditions.xlsx,so i'll color of those in and and color in the rest of my monster,instruction
7IcOJEEObA0,Holidays and Traditions.xlsx,let's check it out in a second,transition
7IcOJEEObA0,Holidays and Traditions.xlsx,we have some more colored,outcome
7IcOJEEObA0,Holidays and Traditions.xlsx,and i did want to show you when you were coloring the big area,instruction
7IcOJEEObA0,Holidays and Traditions.xlsx,you can kind of go a little faster and i'm doing these up and down coloring lines because love monsters is pretty fuzzy,tip
7IcOJEEObA0,Holidays and Traditions.xlsx,but when you get close to another area like the eyes i don't want to accidentally get read into my eyes,tip
7IcOJEEObA0,Holidays and Traditions.xlsx,so you're gonna have to slow your tool down so that you can get around everything without accidentally going over,tip
7IcOJEEObA0,Holidays and Traditions.xlsx,oil pastel doesn't erase just like crayon doesn't erase,tip
7IcOJEEObA0,Holidays and Traditions.xlsx,and so you do want to go slow and just try your best when you get around these items,tip
7IcOJEEObA0,Holidays and Traditions.xlsx,all right we're going to keep going,transition
7IcOJEEObA0,Holidays and Traditions.xlsx,i'm this far now on my love monster,outcome
7IcOJEEObA0,Holidays and Traditions.xlsx,and now i'm going to go back with my black oil pastel,early instruction
7IcOJEEObA0,Holidays and Traditions.xlsx,because if you look at love monster he has this really dark outline around him ,justification
7IcOJEEObA0,Holidays and Traditions.xlsx,and so we can add that just by tracing everything and oil pastel,instruction
7IcOJEEObA0,Holidays and Traditions.xlsx,and love monsters kind of you know hairy looking ,justification
7IcOJEEObA0,Holidays and Traditions.xlsx,so your lines don't have to be very smooth,tip
7IcOJEEObA0,Holidays and Traditions.xlsx,you know you can add in some extra lines where you kind of go out a little bit and you want to make sure that anything you drew in pencil you're chasing,instruction
7IcOJEEObA0,Holidays and Traditions.xlsx,so that means you know around each toe and around each toe nail,instruction
7IcOJEEObA0,Holidays and Traditions.xlsx,that's a little extra work but it's so worth it,side note
7IcOJEEObA0,Holidays and Traditions.xlsx,it really makes if your image pop out and look finished,effect
7IcOJEEObA0,Holidays and Traditions.xlsx,so once you're finished tracing love monster you want to think about all that background space,subgoal
7IcOJEEObA0,Holidays and Traditions.xlsx,what are you going to draw back,subgoal
7IcOJEEObA0,Holidays and Traditions.xlsx,there,subgoal
7IcOJEEObA0,Holidays and Traditions.xlsx,are you going to draw another monster,instruction (multiple)
7IcOJEEObA0,Holidays and Traditions.xlsx,are you gonna draw him inside,instruction (multiple)
7IcOJEEObA0,Holidays and Traditions.xlsx,are you going to draw him outside,instruction (multiple)
7IcOJEEObA0,Holidays and Traditions.xlsx,maybe it's his birthday,instruction (multiple)
7IcOJEEObA0,Holidays and Traditions.xlsx,maybe,instruction (multiple)
7IcOJEEObA0,Holidays and Traditions.xlsx,maybe he's on the bus with his love monster,instruction (multiple)
7IcOJEEObA0,Holidays and Traditions.xlsx,girlfriend,instruction (multiple)
7IcOJEEObA0,Holidays and Traditions.xlsx,you know,filler
7IcOJEEObA0,Holidays and Traditions.xlsx,think about something that you want to use this space for,instruction
7IcOJEEObA0,Holidays and Traditions.xlsx,you,instruction
7IcOJEEObA0,Holidays and Traditions.xlsx,use your imagination,instruction
7IcOJEEObA0,Holidays and Traditions.xlsx,you can look at the book and add your own ideas and enjoy,instruction
OcjCNqfRgP0,Pets and Animals.xlsx,"So hi guys, it's Lanie and ",greeting
OcjCNqfRgP0,Pets and Animals.xlsx,today I'm going to be showing you how to make DIY hamster treats and ,goal
OcjCNqfRgP0,Pets and Animals.xlsx,I'm so excited about this.,side note
