Video ID,Category,Script,Final
kNsjE4HO7tE,Sports and Fitness.xlsx,tell him what you want or if you don't know what you want just call them and tell them what you want to catch and he'll take care of you,side note
kNsjE4HO7tE,Sports and Fitness.xlsx,so let's get started,transition
kNsjE4HO7tE,Sports and Fitness.xlsx,,
kNsjE4HO7tE,Sports and Fitness.xlsx,the first thing that we have is our snare cable,tool
kNsjE4HO7tE,Sports and Fitness.xlsx,this is a four foot piece of one sixteenth inch cable one by nineteen twist and as you can see,tool
kNsjE4HO7tE,Sports and Fitness.xlsx,it has been dipped in formula one's giving a giving it a slight brown color,tool
kNsjE4HO7tE,Sports and Fitness.xlsx,so we have our snare cable,tool
kNsjE4HO7tE,Sports and Fitness.xlsx,as far as tools we need cable cutters to cut our piece of cable we're going to need a good solid hammer to hammer our parts on,tool
kNsjE4HO7tE,Sports and Fitness.xlsx,and we'll need a pair of good american made needle nose pliers,tool
kNsjE4HO7tE,Sports and Fitness.xlsx,as far as parts we're going to use double ferrals and this is one sixteenth inch double ferrals,tool
kNsjE4HO7tE,Sports and Fitness.xlsx,we're going to need our snare lock and you can see these locks,tool
kNsjE4HO7tE,Sports and Fitness.xlsx,i'm using slim locks today and these have also been dipped in formula one,tool
kNsjE4HO7tE,Sports and Fitness.xlsx,,
kNsjE4HO7tE,Sports and Fitness.xlsx,we have our vinyl tubing snare supports cut to,tool
kNsjE4HO7tE,Sports and Fitness.xlsx,i don't know half an inch or something like that,tool
kNsjE4HO7tE,Sports and Fitness.xlsx,we have our swivels and today i'm using a nine gauge heavy duty swivels,tool
kNsjE4HO7tE,Sports and Fitness.xlsx,we need our swivel washers which are just little washers like this,tool
kNsjE4HO7tE,Sports and Fitness.xlsx,and we have stop buttons,tool
kNsjE4HO7tE,Sports and Fitness.xlsx,and i'm using the three thirty second inch stop buttons,tool
kNsjE4HO7tE,Sports and Fitness.xlsx,and i'll explain why,tool
kNsjE4HO7tE,Sports and Fitness.xlsx,when we get to the portion where we put that on,tool
kNsjE4HO7tE,Sports and Fitness.xlsx,,
kNsjE4HO7tE,Sports and Fitness.xlsx,so let's get started,transition
kNsjE4HO7tE,Sports and Fitness.xlsx,,
kNsjE4HO7tE,Sports and Fitness.xlsx,step number one is to take one end of our cable and we're going to take a double ferrell,instruction
kNsjE4HO7tE,Sports and Fitness.xlsx,we're going to slide it on the end of the cable and what we want to do is,instruction
kNsjE4HO7tE,Sports and Fitness.xlsx,,
kNsjE4HO7tE,Sports and Fitness.xlsx,,
kNsjE4HO7tE,Sports and Fitness.xlsx,so what i'm going to do is i'm going to use my needle nose pliers to bend that over and then i'm going to hold it with the pliers and then insert it,instruction
kNsjE4HO7tE,Sports and Fitness.xlsx,,
kNsjE4HO7tE,Sports and Fitness.xlsx,,
kNsjE4HO7tE,Sports and Fitness.xlsx,,
kNsjE4HO7tE,Sports and Fitness.xlsx,,
kNsjE4HO7tE,Sports and Fitness.xlsx,ok so now we're going to hammer this shut,instruction
kNsjE4HO7tE,Sports and Fitness.xlsx,,
kNsjE4HO7tE,Sports and Fitness.xlsx,,
kNsjE4HO7tE,Sports and Fitness.xlsx,,
kNsjE4HO7tE,Sports and Fitness.xlsx,,
kNsjE4HO7tE,Sports and Fitness.xlsx,,
kNsjE4HO7tE,Sports and Fitness.xlsx,,
kNsjE4HO7tE,Sports and Fitness.xlsx,,
kNsjE4HO7tE,Sports and Fitness.xlsx,,
kNsjE4HO7tE,Sports and Fitness.xlsx,so when you try it you'll see but start with your i see if i can get that palm up and then i see that's a natural roll over on that table,instruction
kNsjE4HO7tE,Sports and Fitness.xlsx,and then i'm going to,instruction
kNsjE4HO7tE,Sports and Fitness.xlsx,i put a little memory in it and work and work at once or twice and ,instruction
kNsjE4HO7tE,Sports and Fitness.xlsx,what you want to end up with it is something that looks kind of like that,outcome
kNsjE4HO7tE,Sports and Fitness.xlsx,now the next thing is to load the cable,subgoal
kNsjE4HO7tE,Sports and Fitness.xlsx,,
kNsjE4HO7tE,Sports and Fitness.xlsx,,
kNsjE4HO7tE,Sports and Fitness.xlsx,i use just a nail on the side of this and like i say for details on how to load cable,description
kNsjE4HO7tE,Sports and Fitness.xlsx,watch my other video on it,background info
kNsjE4HO7tE,Sports and Fitness.xlsx,i'll put a a link to it up on the screen,background info
kNsjE4HO7tE,Sports and Fitness.xlsx,but i'm simply going to hold that and then you're looking for a little bit,instruction
kNsjE4HO7tE,Sports and Fitness.xlsx,,
kNsjE4HO7tE,Sports and Fitness.xlsx,ok so now we have our terminal end double federal loan,outcome
kNsjE4HO7tE,Sports and Fitness.xlsx,we've got our cable loaded,outcome
kNsjE4HO7tE,Sports and Fitness.xlsx,the next step is to thread the snare lock on it,subgoal
kNsjE4HO7tE,Sports and Fitness.xlsx,today i'm using slim locks,tool
kNsjE4HO7tE,Sports and Fitness.xlsx,now,tool
kNsjE4HO7tE,Sports and Fitness.xlsx,every lock will thread a little bit differently especially if you're using cam locks,tool
kNsjE4HO7tE,Sports and Fitness.xlsx,but what you want to do is you want to go back to the free end of the cable,instruction
kNsjE4HO7tE,Sports and Fitness.xlsx,and on this slim lock you want to put the free end of the cable through the hole the non locking hole and let me see if i can,instruction
kNsjE4HO7tE,Sports and Fitness.xlsx,,
kNsjE4HO7tE,Sports and Fitness.xlsx,,
kNsjE4HO7tE,Sports and Fitness.xlsx,i'm going to pull this all the way through so that,instruction
kNsjE4HO7tE,Sports and Fitness.xlsx,now i have this to the tab is facing the terminal end,outcome
kNsjE4HO7tE,Sports and Fitness.xlsx,i go back to my free end and then put it through,instruction
kNsjE4HO7tE,Sports and Fitness.xlsx,i like this,instruction
,,pull it through and you can see there is our snare,outcome
,,and now the next step is to put our vinyl tubing support collar on it,subgoal
,,and this is probably i don't know,tool
,,half an inch of vinyl tubing,tool
,,the exact diameter of the tubing is based on what diameter cable that you're using and also what diameter support wire that you're using,tool
,,but you're just going to slide that on the free end all the way down so that when you go to to set the snare,instruction
,,the next step is to put your swivel on and you just stick to the free end of the cable,instruction
,,i like this,instruction
,,slide that on down,instruction
,,normally i would have a smaller diameter washer with a smaller diameter hole and i would use a one sixteenth inch top button,tool
,,but i'm not the smartest guy,side note
,,now the way that works is is you can see see that cable is free to rotate inside the swivel,outcome
,,that's what allows it to swivel it,outcome
,,so at that point our snare is finished and,outcome
,,as you can see it's pretty simple,reflection
,,you know the the the thing is is when you're doing it yourself if you screw some cable up,tip
,,or if you don't have something exactly like you want it you can toss it out or or whatever,tip
,,cut it up and save the parts and redo it but you're in control of it not somebody else,tip
,,so anyway thanks for watching if you'd like,outro
,,if you like what you've seen and you want more please subscribe and hit the notification and consider going to patreon dot com slash meat trapper and becoming a supporter,outro
,,by doing so you'll get to unlock bonus content such as every past episode of meat trapper radio,outro
,,which is my podcast,outro
,,i'm coming up on eighty nine episodes now,outro
,,plus you'll get access to my resistance trapping video series,outro
,,i think we're on episode nine and resistance trapping is trapping from a military or a militia perspective,outro
,,without all of the fancy tools and baits and lures than a normal trapper would have,outro
,,it's all about putting food in your mouth under hostile conditions,outro
,,anyway you can,outro
,,thanks for watching and we'll see you next time,outro
z1Xv6Pa0toE,Cars _ Other Vehicles.xlsx,Greetings and welcome to a very Quick ,greeting
z1Xv6Pa0toE,Cars _ Other Vehicles.xlsx,guide on distributor replacement for Chevy V8 Vortec engines,goal
z1Xv6Pa0toE,Cars _ Other Vehicles.xlsx,If you need more explanation I have a full length video version of this one that should provide all the information that you need,background info
z1Xv6Pa0toE,Cars _ Other Vehicles.xlsx,The only thing I'd recommend that I don't cover in this video is making a mark on the distributor body as well as one on the intake manifold in order to reference it later when installing the new distributor without this mark they could potentially set a check engine light code P1345.,tip
z1Xv6Pa0toE,Cars _ Other Vehicles.xlsx,In which you would need a scan tool in order to set the Cam crank correlation,tip
z1Xv6Pa0toE,Cars _ Other Vehicles.xlsx,Otherwise everything else should be covered in this video,briefing
z1Xv6Pa0toE,Cars _ Other Vehicles.xlsx,"If you need more information, like I said, check out my other video.",background info
z1Xv6Pa0toE,Cars _ Other Vehicles.xlsx,"Once the distributor CAP is removed, you will want to rotate the engine over the top dead center number one compression stroke",early instruction 
z1Xv6Pa0toE,Cars _ Other Vehicles.xlsx,"To do this, you'll want to remove the fan shroud, then manually turn the engine over until the timing mark on the balancer meets the timing mark on the timing cover with the timing marks lined up",early instruction 
z1Xv6Pa0toE,Cars _ Other Vehicles.xlsx,If the distributor rotor is pointing at #1 spark plug wire then you know you have the engine in the correct position,early instruction 
z1Xv6Pa0toE,Cars _ Other Vehicles.xlsx,If the rotor is pointing at #6 spark plug wire then you need to rotate the engine over and.,early instruction 
z1Xv6Pa0toE,Cars _ Other Vehicles.xlsx,,
z1Xv6Pa0toE,Cars _ Other Vehicles.xlsx,At that point you can go ahead and lift the distributor straight out of the engine.,instruction
z1Xv6Pa0toE,Cars _ Other Vehicles.xlsx,"OK, looking at the new distributor, we'll notice a few marks that we want to get lined up before we install the distributor",instruction
z1Xv6Pa0toE,Cars _ Other Vehicles.xlsx,"First off, we have this dimple here at the bottom of the distributor",instruction
z1Xv6Pa0toE,Cars _ Other Vehicles.xlsx,What you want to do is line that dimple up with the white painted line there.,instruction
z1Xv6Pa0toE,Cars _ Other Vehicles.xlsx,"These marks tell us where to set the distributor before we install it, so this is the starting position of the distributor",description
z1Xv6Pa0toE,Cars _ Other Vehicles.xlsx,When you go to install it into the engine.,description
z1Xv6Pa0toE,Cars _ Other Vehicles.xlsx,"I took the liberty of making these two marks right here, so the purpose of these marks, this one is where our final position is",late instruction
z1Xv6Pa0toE,Cars _ Other Vehicles.xlsx,This is where our starting position is so.,description
z1Xv6Pa0toE,Cars _ Other Vehicles.xlsx,Looking back here.,description
z1Xv6Pa0toE,Cars _ Other Vehicles.xlsx,That's our final position,description
z1Xv6Pa0toE,Cars _ Other Vehicles.xlsx,"If the rotor button were installed, we'd be pointing right here our starting position as we know.",description
z1Xv6Pa0toE,Cars _ Other Vehicles.xlsx,Is with the that dimple and that line.,description
z1Xv6Pa0toE,Cars _ Other Vehicles.xlsx,Lined up,description
z1Xv6Pa0toE,Cars _ Other Vehicles.xlsx,so you can make a mark like that if you want,late instruction (optional)
z1Xv6Pa0toE,Cars _ Other Vehicles.xlsx,"If you want to install the distributor with this rotor button already on, you can do that by making this mark",late instruction (optional)
z1Xv6Pa0toE,Cars _ Other Vehicles.xlsx,This will tell you where this needs to face and when it's completely installed.,justification
z1Xv6Pa0toE,Cars _ Other Vehicles.xlsx,It should point there.,justification
z1Xv6Pa0toE,Cars _ Other Vehicles.xlsx,"OK, so we got all the marks lined up as we talked about and we're going to install the distributor",subgoal
z1Xv6Pa0toE,Cars _ Other Vehicles.xlsx,Make sure that that flat spot.,instruction
z1Xv6Pa0toE,Cars _ Other Vehicles.xlsx,On the distributor is roughly parallel.,instruction
z1Xv6Pa0toE,Cars _ Other Vehicles.xlsx,With the back of the intake manifold.,instruction
z1Xv6Pa0toE,Cars _ Other Vehicles.xlsx,"OK, we've got the distributor where we want it, so just going to put this clamp.",instruction
z1Xv6Pa0toE,Cars _ Other Vehicles.xlsx,On the body of the distributor.,instruction
z1Xv6Pa0toE,Cars _ Other Vehicles.xlsx,And then finger tighten this bolt.,instruction
z1Xv6Pa0toE,Cars _ Other Vehicles.xlsx,So you can see a few bumps with the starter,description
z1Xv6Pa0toE,Cars _ Other Vehicles.xlsx,It it didn't quite want to drop down so I just wiggled the base and it dropped right down into the oil pump drive so no need to use the screwdriver to line anything up,instruction (optional)
z1Xv6Pa0toE,Cars _ Other Vehicles.xlsx,That's going to waste a lot of time,instruction (optional)
z1Xv6Pa0toE,Cars _ Other Vehicles.xlsx,It's much easier just to just to get this.,instruction (optional)
z1Xv6Pa0toE,Cars _ Other Vehicles.xlsx,"Just get that hold down right there, start it onto the base of the distributor, get the bolt run down just enough to hold it snug",late instruction
z1Xv6Pa0toE,Cars _ Other Vehicles.xlsx,"Don't tighten it, just finger tight so that this clamp is snug to the distributor base and then bump the starter",late instruction
z1Xv6Pa0toE,Cars _ Other Vehicles.xlsx,"Normally it'll just fall right down by itself, but but for some reason it didn't that time",description
z1Xv6Pa0toE,Cars _ Other Vehicles.xlsx,So I just wiggled the base right here and it dropped right down.,late instruction
z1Xv6Pa0toE,Cars _ Other Vehicles.xlsx,So we'll just barely tighten this bolt.,instruction
z1Xv6Pa0toE,Cars _ Other Vehicles.xlsx,May need to make some adjustments later.,reflection
z1Xv6Pa0toE,Cars _ Other Vehicles.xlsx,"OK guys, we're going to wrap this up",transition
z1Xv6Pa0toE,Cars _ Other Vehicles.xlsx,One piece of advice I will give you is if your installed distributor does not look almost identical to this then don't start the truck because you'll have to reset the top dead center on #1 cylinder and you're probably going to get a check engine light,instruction (optional)
z1Xv6Pa0toE,Cars _ Other Vehicles.xlsx,It really needs to be installed almost identical to what I have here,instruction (optional)
z1Xv6Pa0toE,Cars _ Other Vehicles.xlsx,The rotor should point at the small triangle with the number 8 or towards.,instruction (optional)
z1Xv6Pa0toE,Cars _ Other Vehicles.xlsx,"That number one spark plug wire? What have you? If it's not pointing here and it's pointing back towards the firewall at #6 spark plug, then it's not going to start and needs to point towards number one",instruction (optional)
z1Xv6Pa0toE,Cars _ Other Vehicles.xlsx,"If it's not exactly on number one, that's OK, but it has to be very very close",instruction (optional)
z1Xv6Pa0toE,Cars _ Other Vehicles.xlsx,"If it looks like it's more than a couple degrees off, then you're going to have to start over from scratch or at least pull the distributor out and see if you're off",instruction (optional)
z1Xv6Pa0toE,Cars _ Other Vehicles.xlsx,"Maybe a tooth or two, but if you line up all the marks like I showed you.",instruction (optional)
z1Xv6Pa0toE,Cars _ Other Vehicles.xlsx,"You shouldn't have any problems getting it right on at least the first or second time, so after that, go ahead and get your distributor cap back on your wires",instruction
z1Xv6Pa0toE,Cars _ Other Vehicles.xlsx,"Back in, place airbox back in place as well as the fan shroud and you should be good to go",instruction
z1Xv6Pa0toE,Cars _ Other Vehicles.xlsx,"If it has the check engine light P 1345, then and you're sure your distributor is installed correctly, then you may just be off slightly and at which point",early instruction
z1Xv6Pa0toE,Cars _ Other Vehicles.xlsx,"If you can't get it manually adjusted, you may need to.",early instruction
z1Xv6Pa0toE,Cars _ Other Vehicles.xlsx,Have someone with a scan tool to set that for you,early instruction
,,Thanks again and good luck.,outro
T622Ec77ZPY,Cars _ Other Vehicles.xlsx,today had a clean and maintain your vehicle's leather interior for the summer and spring or all year round for that matter,goal
T622Ec77ZPY,Cars _ Other Vehicles.xlsx,and my jeep grand cherokee has been kind enough to volunteer today to do this,tool
T622Ec77ZPY,Cars _ Other Vehicles.xlsx,i have partnered with lexol to test their products in order to renew and protect my leather interior,tool
T622Ec77ZPY,Cars _ Other Vehicles.xlsx,this vehicle is about three four years old and we definitely have some wear and tear on it and also some stains that i'm hoping that it will get out,motivation
T622Ec77ZPY,Cars _ Other Vehicles.xlsx,lexi's been around since nineteen thirty three,background info
T622Ec77ZPY,Cars _ Other Vehicles.xlsx,in addition to working on the leather interior of your vehicles you can use their products on boots luggage sports equipment,background info
T622Ec77ZPY,Cars _ Other Vehicles.xlsx,shoes furniture and handbags et cetera to be,background info
T622Ec77ZPY,Cars _ Other Vehicles.xlsx,i'll be doing a two step process in this demonstration,briefing
T622Ec77ZPY,Cars _ Other Vehicles.xlsx,first i'll use the leather deep cleaner which will pull some of the dirt and oils off the seat,briefing
T622Ec77ZPY,Cars _ Other Vehicles.xlsx,hopefully get some of this wear and tear off the edge,briefing
T622Ec77ZPY,Cars _ Other Vehicles.xlsx,also you can see a little dark mark right here which might be from the seat belt rubbing over time,briefing
T622Ec77ZPY,Cars _ Other Vehicles.xlsx,plus i have some sticky spots for maybe some soda spilling,briefing
T622Ec77ZPY,Cars _ Other Vehicles.xlsx,then i'll be using the leather deep conditioner to finish it all off,briefing
T622Ec77ZPY,Cars _ Other Vehicles.xlsx,so here's what we're dealing with,description
T622Ec77ZPY,Cars _ Other Vehicles.xlsx,in the back seat of my jeep grand cherokee,description
T622Ec77ZPY,Cars _ Other Vehicles.xlsx,looks like soda splatter,description
T622Ec77ZPY,Cars _ Other Vehicles.xlsx,something sticky and dirty all through the back seat,description
T622Ec77ZPY,Cars _ Other Vehicles.xlsx,i'll give you before and after,description
T622Ec77ZPY,Cars _ Other Vehicles.xlsx,definitely not clean,description
T622Ec77ZPY,Cars _ Other Vehicles.xlsx,two concerns of mine,description
T622Ec77ZPY,Cars _ Other Vehicles.xlsx,this one right here,description
T622Ec77ZPY,Cars _ Other Vehicles.xlsx,of course because of the seat belt rubbing against there,description
T622Ec77ZPY,Cars _ Other Vehicles.xlsx,that's bad,description
T622Ec77ZPY,Cars _ Other Vehicles.xlsx,it's kind of dull all over and this spot here where everyone sits steps into the car whether they have dirty jeans or whatever it is,description
T622Ec77ZPY,Cars _ Other Vehicles.xlsx,but you can really tell,description
T622Ec77ZPY,Cars _ Other Vehicles.xlsx,hope you can tell,description
T622Ec77ZPY,Cars _ Other Vehicles.xlsx,i know i can from my view that it's dark right here from just the rubbing of people getting inside the car,description
T622Ec77ZPY,Cars _ Other Vehicles.xlsx,so that is our before and we'll come back in a matter of minutes and this will be gone,subgoal
T622Ec77ZPY,Cars _ Other Vehicles.xlsx,and this will be gone,subgoal
T622Ec77ZPY,Cars _ Other Vehicles.xlsx,just watch,transition
T622Ec77ZPY,Cars _ Other Vehicles.xlsx,you'll find directions on the back of the bottle,background info
T622Ec77ZPY,Cars _ Other Vehicles.xlsx,but i'll tell you right now shake it really well,instruction
T622Ec77ZPY,Cars _ Other Vehicles.xlsx,you'll need a couple of rags,tool
T622Ec77ZPY,Cars _ Other Vehicles.xlsx,i got a damp one here and this clean one,tool
T622Ec77ZPY,Cars _ Other Vehicles.xlsx,this is dry or use this to wipe up afterwards,tool
T622Ec77ZPY,Cars _ Other Vehicles.xlsx,so after a shake it i'm going to spray on here a couple of sprays,instruction
T622Ec77ZPY,Cars _ Other Vehicles.xlsx,there's a damp part it's gonna come out kind of clear,description
T622Ec77ZPY,Cars _ Other Vehicles.xlsx,so we're going to do is going to rub it in,instruction
T622Ec77ZPY,Cars _ Other Vehicles.xlsx,i will be here i'm go directly on see if that makes a difference,instruction
T622Ec77ZPY,Cars _ Other Vehicles.xlsx,yeah a little more suds there,description
T622Ec77ZPY,Cars _ Other Vehicles.xlsx,lex all does offer an applicator sponge or brush that if you want to get a little deeper in it for some of those harder to clean out spots,tool (optional)
T622Ec77ZPY,Cars _ Other Vehicles.xlsx,so i've already used this,description
T622Ec77ZPY,Cars _ Other Vehicles.xlsx,it says you can use a a damp cloth to wipe it down which i'll do now,instruction
T622Ec77ZPY,Cars _ Other Vehicles.xlsx,it's going to wipe off any of the excess here and then i'll show you the after,instruction
T622Ec77ZPY,Cars _ Other Vehicles.xlsx,only downside about doing a video like this and putting on youtube is that all my friends and family are going to ask me to clean the leather inside their vehicles after they see how good this works,side note
T622Ec77ZPY,Cars _ Other Vehicles.xlsx,ok i'm done with step one,transition
T622Ec77ZPY,Cars _ Other Vehicles.xlsx,the cleaning is complete,transition
T622Ec77ZPY,Cars _ Other Vehicles.xlsx,let's do a little before and after video because i think you'll be really impressed,transition
T622Ec77ZPY,Cars _ Other Vehicles.xlsx,all right the moment of truth,transition
T622Ec77ZPY,Cars _ Other Vehicles.xlsx,here's the armrest in the middle,outcome
T622Ec77ZPY,Cars _ Other Vehicles.xlsx,no more stickiness nice and clean don't you think,outcome
T622Ec77ZPY,Cars _ Other Vehicles.xlsx,one thing i can't convey on camera is how good this smells like a new car smell,outcome
T622Ec77ZPY,Cars _ Other Vehicles.xlsx,no it's better,outcome
T622Ec77ZPY,Cars _ Other Vehicles.xlsx,here's a spot where people get in trying to show you a nice and close up how to clear that looks how new it looks,outcome
T622Ec77ZPY,Cars _ Other Vehicles.xlsx,now let's go to that spot by the seat belt,outcome
T622Ec77ZPY,Cars _ Other Vehicles.xlsx,can you see the mark,outcome
T622Ec77ZPY,Cars _ Other Vehicles.xlsx,maybe a little bit,outcome
T622Ec77ZPY,Cars _ Other Vehicles.xlsx,i still have the conditioner to apply,subgoal
T622Ec77ZPY,Cars _ Other Vehicles.xlsx,step two begins like step one,transition
T622Ec77ZPY,Cars _ Other Vehicles.xlsx,shake the conditioner,instruction
T622Ec77ZPY,Cars _ Other Vehicles.xlsx,we'll squirt a couple of squirts on our towel or your applicator and we'll apply it to the seat and then let it sit for a couple minutes,early instruction
T622Ec77ZPY,Cars _ Other Vehicles.xlsx,then we'll wipe it off,early instruction
T622Ec77ZPY,Cars _ Other Vehicles.xlsx,all right,filler
T622Ec77ZPY,Cars _ Other Vehicles.xlsx,i'll let this sit for a couple of minutes and i'll come back with a clean cloth and i'll wipe off the excess,early instruction
T622Ec77ZPY,Cars _ Other Vehicles.xlsx,ok i'm back after a couple of minutes,transition
T622Ec77ZPY,Cars _ Other Vehicles.xlsx,so let's go ahead and wipe this off and then we'll do a final look at how we've done,instruction
T622Ec77ZPY,Cars _ Other Vehicles.xlsx,here is your final look,outcome
T622Ec77ZPY,Cars _ Other Vehicles.xlsx,we showed you the before,outcome
T622Ec77ZPY,Cars _ Other Vehicles.xlsx,we showed you after the deep cleaner and this is after the deep conditioner,outcome
T622Ec77ZPY,Cars _ Other Vehicles.xlsx,i'll let your eyes tell you the truth of how good this looks,outcome
T622Ec77ZPY,Cars _ Other Vehicles.xlsx,the thing is it also smells great,outcome
T622Ec77ZPY,Cars _ Other Vehicles.xlsx,how about that edge on the spot that i was most concerned about right there,outcome
T622Ec77ZPY,Cars _ Other Vehicles.xlsx,can you see it,outcome
T622Ec77ZPY,Cars _ Other Vehicles.xlsx,barely,outcome
T622Ec77ZPY,Cars _ Other Vehicles.xlsx,a well i think the results speak for themselves,reflection
T622Ec77ZPY,Cars _ Other Vehicles.xlsx,the combination of the deep cleaner and deep conditioner did an amazing job on the interior of my jeep grand cherokee,reflection
T622Ec77ZPY,Cars _ Other Vehicles.xlsx,it looks brand spanking new smells great and looks great,reflection
T622Ec77ZPY,Cars _ Other Vehicles.xlsx,go to lexol dot com for more information and to find the closest place to pick up your lexol products,side note
T622Ec77ZPY,Cars _ Other Vehicles.xlsx,until next time,outro
T622Ec77ZPY,Cars _ Other Vehicles.xlsx,thanks so much for watching,outro
T622Ec77ZPY,Cars _ Other Vehicles.xlsx,i'll see you next time,outro
T622Ec77ZPY,Cars _ Other Vehicles.xlsx,audios,outro
9mjXFA1TMTI,Cars _ Other Vehicles.xlsx,hello ladies and gentlemen ,greeting
9mjXFA1TMTI,Cars _ Other Vehicles.xlsx,today i'm working on a two thousand and twelve and a sonata,goal
9mjXFA1TMTI,Cars _ Other Vehicles.xlsx,the issue we're having here is that the break lights do not work consistently,motivation
9mjXFA1TMTI,Cars _ Other Vehicles.xlsx,the third eye brake light and this one here has always worked but these side lights are not working consistently,motivation
9mjXFA1TMTI,Cars _ Other Vehicles.xlsx,so they have removed some of the bulbs in them in order to keep them from burning out,briefing
9mjXFA1TMTI,Cars _ Other Vehicles.xlsx,and i believe there's a short and we're going to try to find it,briefing
9mjXFA1TMTI,Cars _ Other Vehicles.xlsx,but first i'll show you that the lights are working,subgoal
9mjXFA1TMTI,Cars _ Other Vehicles.xlsx,so we have all the lights working and and you can see that the running lights are actually working here,instruction
9mjXFA1TMTI,Cars _ Other Vehicles.xlsx,i'm gonna go ahead and shut those off,instruction
9mjXFA1TMTI,Cars _ Other Vehicles.xlsx,nice to see that they're off baby,instruction
9mjXFA1TMTI,Cars _ Other Vehicles.xlsx,we hit the brakes so if you can see that just the third eye is lighting up,instruction
